<?xml version="1.0" encoding="UTF-8"?>

<!DOCTYPE expresso-config PUBLIC
          "-//Jcorporate Ltd//DTD Expresso Configuration 4.0//EN"
          "http://www.jcorporate.com/dtds/expresso-config_4_0.dtd">
<!--<!DOCTYPE expresso-config SYSTEM "./expresso-config_4_0.dtd">-->
<expresso-config>
   <logDirectory>%web-app%WEB-INF/log</logDirectory>
   <strongCrypto>n</strongCrypto>
   <servletAPI>2_3</servletAPI>

  <context name="default">
    <description>Oracle Database</description>


<!--
	<jdbc driver="oracle.jdbc.driver.OracleDriver"
    		url="jdbc:oracle:thin:@172.19.1.212:1521:PRBSUN"
    		connectFormat="1"
    		login="user1"
    		password="user1"
			dateTimeUpdateFormat="yyyy-MM-dd HH mm ss"
    		dateTimeUpdateFunction="TO_DATE( %s,'YYYY-MM-DD HH24 MI SS')"
		cache="n"
	/>	
-->


<!--
	<jdbc driver="oracle.jdbc.driver.OracleDriver"
    		url="jdbc:oracle:thin:@192.168.1.54:1521:PRBSUN"
    		connectFormat="1"
    		login="user1"
    		password="user1"
			dateTimeUpdateFormat="yyyy-MM-dd HH mm ss"
    		dateTimeUpdateFunction="TO_DATE( %s,'YYYY-MM-DD HH24 MI SS')"
		cache="n"
	/>	
-->

<!-- datasource de desarrollo -->
	<jdbc driver="oracle.jdbc.driver.OracleDriver"
    		url="jdbc:oracle:thin:@172.18.1.37:1521:dbspdesa"
    		connectFormat="1"
    		login="user1"
    		password="user1"
			dateTimeUpdateFormat="yyyy-MM-dd HH mm ss"
    		dateTimeUpdateFunction="TO_DATE( %s,'YYYY-MM-DD HH24 MI SS')"
			cache="n"
	/>	


<!--
	<jdbc driver="oracle.jdbc.driver.OracleDriver"
    		url="jdbc:oracle:thin:@172.18.1.37:1521:dbspdesa"
    		connectFormat="1"
    		login="user1"
    		password="user1"
			dateTimeUpdateFormat="yyyy-MM-dd HH mm ss"
    		dateTimeUpdateFunction="TO_DATE( %s,'YYYY-MM-DD HH24 MI SS')"
			cache="n"
	/>	
 -->
 <!--
	<jdbc driver="oracle.jdbc.driver.OracleDriver"
    		url="jdbc:oracle:thin:@192.168.171.221:1521:orcl"
    		connectFormat="1"
    		login="user1"
    		password="user1"
			dateTimeUpdateFormat="yyyy-MM-dd HH mm ss"
    		dateTimeUpdateFunction="TO_DATE( %s,'YYYY-MM-DD HH24 MI SS')"
			cache="n"
	/>
 -->
<!-- 
	<jdbc driver="oracle.jdbc.driver.OracleDriver"
    		url="jdbc:oracle:thin:@172.18.1.45:1521:DBS04"
    		connectFormat="1"
    		login="user1"
    		password="user12002"
			dateTimeUpdateFormat="yyyy-MM-dd HH mm ss"
    		dateTimeUpdateFunction="TO_DATE( %s,'YYYY-MM-DD HH24 MI SS')"
		cache="n"
	/>	
-->

	<type-mapping>
  		<java-type>LONGVARCHAR</java-type>
  		<db-type>varchar(4000)</db-type>
	</type-mapping>

	<type-mapping>
  		<java-type>DATE</java-type>
  		<db-type>DATE</db-type>
	</type-mapping>

	<type-mapping>
  		<java-type>DOUBLE</java-type>
  		<db-type>FLOAT</db-type>
	</type-mapping>

	<type-mapping>
  		<java-type>INTEGER</java-type>
  		<db-type>NUMBER</db-type>
	</type-mapping>

	<type-mapping>
  		<expresso-type>datetime</expresso-type>
  		<db-type>DATE</db-type>
	</type-mapping>

    <images>%context%/%expresso-dir%/images</images>
    <startJobHandler>n</startJobHandler>
    <showStackTrace>y</showStackTrace>
    <mailDebug>n</mailDebug>
  </context>

</expresso-config>